{
  "schema_version": 1,
  "id": "example-project",
  "name": "Projekt przyk\u0142adowy",
  "workspace_ref": "example-workspace",
  "repository": {
    "path_in_workspace": "/home/tom/github/organizacja/projekt",
    "github": null,
    "base_branch": "main"
  },
  "executor": {
    "policy": "latest-valid-benchmark",
    "selected": null,
    "benchmark_receipt": null
  },
  "checks": [
    {
      "name": "unit",
      "argv": [
        "python",
        "-m",
        "unittest",
        "discover",
        "-s",
        "tests"
      ]
    }
  ],
  "tickets": {
    "directory": ".planfile",
    "allocator": "semcod/planfile"
  },
  "delivery": {
    "merge": "protected-validator",
    "release": "none"
  }
}
